Participant ID,Q1,Q2,Q3,Q4,Q5,Q6,Q7,Q8,Q9,Comments
1,4,5,4,3,5,4,4,5,4,Good course overall.
2,3,4,3,4,3,5,3,4,3,Some topics were hard.
3,5,5,5,4,4,5,5,4,5,Excellent experience.
4,4,4,3,3,4,4,4,3,4,Enjoyed the interactive lessons.
5,3,3,4,3,3,4,3,4,3,Could use more real-world examples.
6,5,5,5,4,5,5,5,4,5,Highly recommend this course.
7,4,3,4,3,4,3,4,3,4,Instructor was helpful.
8,3,4,3,4,3,4,3,4,3,Needs more hands-on exercises.
9,5,5,5,4,5,4,5,4,5,Best course I've taken.
10,4,4,4,3,4,3,4,3,4,Enjoyed the guest lectures.
